,Date,Text,Verse,Theme,Source,Version,Attributed,Additional Information,Word
0,13-Dec-24,"Remember those in prison, as if you were there yourself. Remember also those being mistreated, as if you felt their pain in your own bodies.",Hebrews 13:3,Empathy,Verse,New American Standard,,,
0,13-Dec-24,"My son, if sinful men entice you, do not give in to them.",Proverbs 1:10,Temptation,Proverb,New International Version,,,
0,13-Dec-24,Blessed is the one who does not walk in step with the wicked or stand in the way that sinners take or sit in the company of mockers,Psalm 1:1,Blessing,Psalm,New International Version,,,
0,13-Dec-24,Text Our greatest weakness lies in giving up. The most certain way to succeed is always to try just one more time.,,Perseverance,Quote of the Day,,Thomas Edison,,
0,13-Dec-24,To divide or split into two branches or parts.,,,Word of the Day,,,,Bifurcate
